{
  "order_id": "canonical-order-1001",
  "source": "shopify",
  "source_order_id": "gid://shopify/Order/1001",
  "created_at": "2026-05-18T10:30:00Z",
  "currency": "EUR",
  "customer": {
    "customer_id": "gid://shopify/Customer/501",
    "email": "customer@example.com"
  },
  "shipping_address": {
    "name": "Mira Jensen",
    "address1": "Example Street 12",
    "address2": "Floor 2",
    "city": "Berlin",
    "postal_code": "10115",
    "country_code": "DE"
  },
  "line_items": [
    {
      "line_item_id": "gid://shopify/LineItem/7001",
      "sku": "RUG-ATLAS-170X240-SAND",
      "title": "Atlas Wool Rug 170x240 Sand",
      "quantity": 1,
      "unit_price": 349.0,
      "product_family": "rug",
      "attributes": {
        "material": "wool",
        "size": "170x240 cm",
        "color": "sand",
        "shape": "rectangle"
      }
    }
  ],
  "totals": {
    "subtotal": 349.0,
    "shipping": 4.9,
    "tax": 5.0,
    "grand_total": 358.9
  },
  "idempotency_key": "shopify-order-gid://shopify/Order/1001"
}
